id,image_url,category,color,season,occasion,style_notes
1,https://example.com/img1.jpg,Dress,Red,Summer,Party,Off-shoulder mini dress with heels
2,https://example.com/img2.jpg,Blazer,Black,Winter,Business,Structured black blazer with slim pants
3,https://example.com/img3.jpg,T-shirt,White,Spring,Casual,Classic white tee with denim shorts
4,https://example.com/img4.jpg,Coat,Beige,Autumn,Formal,Long trench coat with boots
5,https://example.com/img5.jpg,Jeans,Blue,All,Casual,Skinny blue jeans with ankle boots
6,https://example.com/img6.jpg,Skirt,Pink,Summer,Date,Ruffled midi skirt with crop top
